taskname	title	thumbnail	description	tags	totalTime	step1	time1	step2	time2	step3	time3	step4	time4	step5	time5
toilet	トイレ掃除	https://res.cloudinary.com/dix8ructo/image/upload/v1632614420/hackday/img/toilet_lqjxoc.jpg	面倒なトイレ掃除を「流せるトイレシート」1枚でピカピカに掃除できる方法です。	"掃除,トイレ,簡単"	10	ゴム手袋、トイレ掃除シートを用意する	2	トイレ掃除シートでドアノブとトイレの蓋、レバー（スイッチ）を拭く	2	トイレ掃除シートで便座、便座の裏の順に拭く	2	トイレ掃除シートで便器の中、便器のかえしを拭く	3	シートを広げて、便器の中に入れ流す	1
maintenance	空気清浄機メンテナンス	https://res.cloudinary.com/dix8ructo/image/upload/v1632614422/hackday/img/maintenance_z6bsil.jpg	お部屋の空気をキレイにする空気清浄機ですが、定期的に掃除をすることで、安定して動作し、電気代にも影響が出ます。	"家電,掃除,メンテナンス,定期"	18	電源コードを抜き、乾いた布と掃除機を準備する	2	パネルやフィルターを外してホコリを吸い取る	5	内部のホコリをや汚れなどを拭きとる	5	センサーと本体を拭く	3	外した部品を戻して、動作を確認する	3
drivercard	免許の更新準備をする	https://res.cloudinary.com/dix8ructo/image/upload/v1632614420/hackday/img/drivercard_ne5wro.png	運転免許更新年の誕生日の概ね40日前になると、手続きの案内ハガキが届きます。免許の更新手続きは誕生日の前後1か月間の間が更新期間となり有効期間が過ぎると手続きが変わってしまいます。忘れずに手続きしましょう。	"申請,免許"	10	更新手続きのはがきで記載事項に変更の有無を確認する	1	講習区分が何かを確認する	1	申請可能な場所と日時から申請する日時・場所を決める	5	手数料と更新はがきを保管する	2	更新日の予定をスケジュールに登録する	1
passport	パスポート更新準備をする	https://res.cloudinary.com/dix8ructo/image/upload/v1632614420/hackday/img/passport_ek9tip.jpg	パスポートの更新は、有効期限が1年未満になった時から行うことができます。必ずしも更新する必要はありませんが、期限が切れてしまった場合は新規発行することになるため、有効なうちに更新手続きをしておくほうが安心です。	"申請,パスポート,"	21	種類、申請日と申請場所を決める	5	必要書類(住民票、戸籍謄本)を手配する	5	パスポート申請書を作成する	3	手数料を現金で準備する	3	パスポート用の写真を撮る予定を決める	5
residentcard	住民票の写しを郵送で請求	https://res.cloudinary.com/dix8ructo/image/upload/v1632614420/hackday/img/residentcard_kgvxxl.jpg	住民登録をしている人の住所、氏名、生年月日、性別、住民となった日、本籍、筆頭者、世帯主との続柄、前住所地などを記載したものです。市町村役所の窓口、郵送での請求、マイナンバーカードを用いたコンビニでの請求、eKYCによる請求ができます。	"請求,証明書,住民票"	53	住民登録先から請求書をダウンロードし印刷する	5	本人確認書類をコピーする	3	定額小為替、切手、封筒を購入する	30	請求書に記入し、封筒に宛先を記入する	5	郵便ポストに投函する	10